{"allocation":{"attempts_per_device_condition":10,"devices_per_population":1,"populations":1},"authentication":{"config_version":"puf-snn-auth-config-v2","handshake_timeout_ms":10000,"max_pending_sessions":128,"max_sessions_per_process":10000,"max_windows":10000,"protocol_profile":"puf-snn-l3-credential-admission-v1-wire2","session_ttl_ms":300000,"warmup_iterations":0},"bootstrap_resamples":10000,"bootstrap_seed":2026101903,"conditions":[{"common_offsets":[0],"name":"independent_nominal","rho":0.0,"sigma":0.1},{"common_offsets":[0],"name":"independent_stress","rho":0.0,"sigma":0.25},{"common_offsets":[-1,1],"name":"common_control","rho":0.0,"sigma":0.1},{"common_offsets":[0],"name":"differential_rho50","rho":0.5,"sigma":0.1},{"common_offsets":[0],"name":"differential_rho90","rho":0.9,"sigma":0.1}],"confidence_level":0.95,"consumer_id":"recording-consumer-v1","enrollment_noise_std":0.0,"execution_limits":{"formal_execution_enabled":false,"nonformal_max_arm_attempts":150,"nonformal_max_matched_trials":50,"retries":0},"experiment_id":"week8-three-arm-auth-v1","interval_scope":"pointwise","manufacturing_std":1.0,"master_seed":2026101901,"mode":"nonformal","noise_model_id":"puf-snn-correlated-noise-v1","policies":["single-read-v1","majority-3-v1","stored-provisioned-v1"],"primary_rho":0.9,"schedule_seed":2026101902,"schema_version":"week8-three-arm-auth-v1:config","secondary_rho":0.5,"source_configuration":{"majority-3-v1":{"acquisition_config_version":"puf-snn-acquisition-v1","reads":3,"runtime_decodes":1},"single-read-v1":{"acquisition_config_version":"puf-snn-acquisition-v1","reads":1,"runtime_decodes":1},"stored-provisioned-v1":{"fallback":false,"provider":"trusted-in-memory-v1","provisioning":"same-enrolled-credential-before-timing","reads":0,"runtime_decodes":0}},"stored_schedule":"one-per-matched-trial-noise-cell-repeated-control","timing_methodology":{"authorization_cost":"inclusive-minus-verification-child","clock":"perf_counter_ns","excluded_work":["enrollment","provisioning","endpoint-setup","shared-noise-vector","window-template","model-loading"],"handshake_entropy":"os-random-unmatched","profile":"cold-process-no-harness-warmup-v1","recurring_windows":false,"stage_spans":"inclusive-with-parent-links","warmup_attempts":0},"window_id":"week7-fixed-window-v1"}
